review id,review title,review text,review rating,review do_recommend,review num_helpful,review date
21902,very easy to use great for all ages,I bought 3 of these. They are great and very durable . . The price is amazing .,5,True,1,2015-11-06
91105,Good purchase,Very satisfied so far. Easy to use and great price,5,True,1,2015-11-06
80805,Great product,Great product. This is my 2nd one. My first one was stolen. It is very user friendly.,5,True,1,2015-11-06
70505,Gets the job done.,I like the Kindle Fire. I use it to access my movies and apps. I use it for my gaming apps.,3,True,1,2015-11-06
49905,Good price,This tablet was perfect for my 10 year old. She bought it with her own money because it was so affortable.,5,True,2,2015-11-06
29305,Great for readers,My daughter would not read before she got her kindle. She love this and now reads all the time. Books are cheaper and less space needed in your home. Great games.,5,True,1,2015-11-06
88208,it get great picture,I enjoy my fire tablet and I like it is HD picture,5,True,2,2015-11-06
47008,just ordered mind,I just ordered mind 5 minutes ago is this the newest edition the 2015 kindle some of my friends got this and I heard it is such a great tablet,5,True,5,2015-11-04
16108,Great,Great tablet for the price.I would recommend this to friends and family,5,True,2,2015-11-03
44111,great looking games and books also,games are excellent and great books to read as well,5,True,1,2015-11-02
23511,Not many free apps,I needed this for my two six year olds to be able to use during our drive to Disney. You are unable to get most apps that are offered on iTunes and android market so I returned.,2,False,5,2015-11-02
51514,Good for price,Great for price. Wish the Amazon App store had more apps. Overall good especially for prices.,4,True,4,2015-10-29
41214,Great for price,Great product for children at this price...makes good Christmas gift,5,True,2,2015-10-26
14820,Good cheep tablet,This is a really good device for those who want a cheep tablet,5,True,1,2015-10-18
53123,Good tablet for school age children,Bought for my granddaughter.. She love it..got a great warrant also,5,True,2,2015-10-17
19326,Good and inexpensive tablet,Great price for a decent tablet. Amazon hit it out the park with this tablet.,4,True,1,2015-10-17
9026,Good for first time users,I bought this tablet for my 9 year old sister as a birthday present. It is decent but not as good as other tablets on the market. I recommend it for first time users or light tablet users.,4,True,6,2015-10-17
57629,Great tablet for the price,I am very impressed with the tablet. For the price it is great. Apps load up quick and look great on the tablet. The OS is easy to navigate.,5,True,1,2015-10-16
37029,Great product,I preorder 4 for my kids and they love it. The use it to connect with families in Mexico. They use it for school as well when they need to use the web.,5,True,1,2015-10-16
75332,Great value for the cost,An excellent tablet at a low cost. It more than met my expectations for basic use such as video watching and gaming.,4,True,2,2015-10-16
41535,Great tablet for great price,Bought for my 4 yr old. ...great Tablet for his age. ..love the aps,4,True,0,2015-10-16
10635,Great product for the price,Great inexpensive product for the price. Just like the Kindle Fire HDX except for no mayday function. Both front and rear cameras are a plus. Love the Amazon kindle fire,5,True,1,2015-10-16
18038,Good,I always finding what I need and better customer service at the Best Buy,4,True,1,2015-10-16
97541,Good entry level tablet,Good product for the money. Compared to earlier versions not as durable. The outside casing is plastic. Not good. For the money good buy.,3,True,1,2015-10-16
25441,Amazon Kindle Fire,I absolutely love my kindle fire. I received cash back for purchasing a new MacBook Pro Retina laptop and purchased the Kindle and cover jacket.,5,True,1,2016-05-29
94644,enjoyed by all ages,this is my fifth kindle i have bought. I love them.,5,True,0,2016-05-28
74044,great basic tablet for the price,great product Amazon does a real good job giving you big bang for your buck the tablet is rapid and battery life is good,4,True,0,2016-05-28
12244,As expected,Fire tablet is a cheap one but good enough for my porpose. Actually you get much more than what you pay. Is an excellent retribution for your money.,4,True,0,2016-05-28
1944,great tablet for my son,son loves this he can do alot of things on it great quality for the price,5,True,0,2016-05-28
91747,Good product,It works good I would recommend to friends and family,5,True,0,2016-05-27
29947,Gift,It was given to my friend as a gift. I hope he likes it.,3,True,0,2016-05-27
9347,Great for children,I love that I can set time limits on how much time my kids can play. I love being able to have them read for a certain amount of time before getting to pay also,4,True,0,2016-05-27
88850,overall great starter tablet,Fast up to 5 windows open without problemsCamera not very good pics come out blurry,3,True,1,2016-05-27
6450,Good for price,Wanted a decent tablet for my teenage daughter without spending a lot. Other then the ads on the lock screen the tablet is perfect for her needs. You can remove the ads which to me is worth it.,4,True,0,2016-05-27
96253,Not a fan,The constant bombardment of ads when I turn on my tablet is not an experience that I enjoy. I would recommend you buy ANY other than one that runs the Fire OS. For the same price you can get a cheap android tablet and do a lot more with it.,2,False,0,2016-05-27
55053,great tablet for beginners and very compact,i would recomend this product to anybody kids and adults,5,True,0,2016-05-27
44753,AWESOME TABLET,The fire tablet is awesome. I thoroughly enjoy the tablet. Everyone should have this item.,5,True,0,2016-05-27
34453,Excellent,This item is very functional. I am beyond pleased.,5,True,0,2016-05-27
13853,As always a good buy.,Just what you would expect from Amazon. Holds a charge well and does everything you would expect.,4,True,0,2016-05-27
83056,Good tablet,I like this one because it is easy to operator and the battery last a long time.,5,True,0,2016-05-26
62456,Great,Great purchase.. Bought for my two children. They love it,5,True,0,2016-05-26
80159,Bought 2 kindle fires,Great for my younger kids. My son is autistic. WTG,5,True,0,2016-05-27
59559,Good for a budget,Its a fast and reliable tablet once you get past thw advertising. You can pay to have them removed but if you could afford that mights as well get the one without the advertising.,4,True,0,2016-05-27
38959,Good product,Granddaughter loves it. She plays on it daily and downloads the games with no problem,4,True,0,2016-05-27
8059,Great for kids,My kids love there new tablets they were affordable and easy to use my kids love them,5,True,0,2016-05-23
46362,great for reading books online,Love the size for reading and also for playing games online. Tablet is fast to respond.,4,True,2,2016-05-22
15462,Great tablet for a beginner,Love the ease to download apps and music. The size is perfect and it lights up pretty well,5,True,0,2016-05-21
53765,Works great,Got it as a gift for my son to replace his old kindle.,5,True,3,2016-05-21
43465,Very Functional,Very happy with this purchase. For the price you can not go wrong. I mainly use for reading so I am sure for a techy geek this would not work.,5,True,1,2016-05-21
33165,Kindle Fire,This is a good little device. Well worth the money. Facebook is hard to read but overall a good product.,4,True,0,2016-05-21
92068,Easy to us,Love the reading on my kindle. The camera is great.,5,True,1,2016-05-21
71468,Great tablet for kids,This is a great tablet for my kid he can watch and play all the games for his age,5,True,0,2016-05-20
9668,the tablet works fine,All the icons on the tablet works just fine. I got help,5,True,0,2016-05-20
89171,Makes a Great Gift,Bought this as a gift. Does everything the recipient needed. All features listed were adequate.,5,True,0,2016-05-20
68571,Kindle tablet,Honestly the worst tablet ever owned. Was very slow and unreliable would switch off,1,False,0,2016-05-20
58271,I would reccomend,I would recommend this to anyone it is a great deal and it has a great screen,5,True,0,2016-05-20
37671,Great tablet for a child.,Amazon tablet is great to have. Now I wish I bought more gb.,4,True,0,2016-05-20
27371,Great gift,I bought this for my mom and she absolutely loves it.,5,True,0,2016-05-20
6771,GREAT ADDITION,MY DAUGHTER JUST LOVES THIS. EASY TO USE AND SHE IS ABLE TO DO EVERYTHING SHE WANTED ON IT. GREAT PRICE GREAT PRODUCT,5,True,0,2016-05-20
14174,good value,Great eReader for the price. Amazon Prime member. I use eReader when I travel.,5,True,0,2016-05-20
3874,Great buy,It does what I need it to do and if very affordable,5,True,0,2016-05-20
93677,very good product,It has a good sized screen. Very good wifi receiver. Overall good product.,5,True,0,2016-05-20
52477,Replacement,I love my Kendle Fire. Fits in my purse perfectly. Always have books on hand.,5,True,0,2016-05-20
21577,Awesomeness,This is an awesome little tablet justright for reading and looking up images and things on the net.,5,True,0,2016-05-20
8380,Great gift for the price,I got the tablet for my two year old son and he loves his tablet.,5,True,0,2016-05-19
67283,good,very good product............I would recommend this to a friend,5,True,0,2016-05-17
36383,keep impressing me,Well for a tablet of this price so compact and complete is not much to ask for than just your self to use it to the maximum capacity.I love this Kindell Best product ever.,5,True,0,2016-05-16
84986,Excellent Peoduct,My son love this tab and I recommend this. This is a great product.,4,True,0,2016-05-19
43786,kids love it,Great tablet plan on purchasing another . Not slow happy with the speed,5,True,0,2016-05-19
12886,Great tablet for that price,I use it mostly for reading and it works well. I only wish that the camera was better but it is okay for that price.,4,True,0,2016-05-15
61489,Great,Great price and easy to use.Wife loves it more than any other tablet.,4,True,0,2016-05-15
30589,Good price,Great device for children. Impressed by the specs.,5,True,0,2016-05-14
79192,Great Tablet for Beginner,Great Tablet for Beginner. Easy to use and navigate.,4,True,0,2016-05-14
68892,Awesome,Cheap tablet that runs great and plays hearthstone silky smooth,5,True,0,2016-05-14
48292,Very handy,I love tge size of the tablet. I can store it in my bookbag and go about my way.,5,True,0,2016-05-13
37992,Love it,I got 2 for my kids for Xmas and there working real good they love them and I love the price better then eBay ones that would only work for some time then will stop charging,5,True,0,2016-05-13
86595,Its great,I took a billion pictures and they are all clear all my games download with no problem and I will recommend this to my sister,5,True,0,2016-05-13
76295,Great secondary tablet,I enjoy having this smaller tablet to carry around,5,True,0,2016-05-13
24795,We have 4 so easy to use,The kindle fire is so handy and easy to use.We own 4,5,True,0,2016-05-13
14495,great for reading,I really enjoy reading books on this. Glare in the sun but great indoors.,5,True,0,2016-05-13
93998,Good reader battery power not what advertized,Ok reader battery power not what advertized. Not able to upgrade,3,True,0,2016-05-13
63098,Simple and easy from the minute you open the box,Simple to set up. Simple to use. Great display with a quick system to back it up.,5,True,0,2016-05-13
52798,great price for the product,kids love it and i like it because it has child proof qualities.,4,True,0,2016-05-13
32198,gift for grandchild,My son told me about this product and spoke highly so we purchased for grandchild. Very satisfied.,4,True,0,2016-05-13
29301,Great little tablet,I have several of these tablets and they are still my favorite compared to my expensive IPad. Best buy ships pretty fast and I am pleased with their online store.,5,True,0,2016-05-09
98504,Good product for the money,Good Value for the money it cost.My teens love them.,4,True,0,2016-05-09
88204,Just what I needed.,My old kindle was on its last legs and I needed a multi finctional tablet that was also a reader. The Kindle fire fit the bill excellentlty.,5,True,0,2016-05-09
75007,Great product,My first purchasing an Amazon product I was very thrilled with the pricing and availabilty.,4,True,0,2016-05-07
64707,Excellent,Bought this for my mother in law for her birthday. Loaded it with books and music and made her the happiest lady in town. Works great as a reader and also for music when paired with a good set of blue tooth headphones.,5,True,0,2016-05-07
23507,Great product,This product does everything. An ipad does at a quarte of the price. Am very pleased. Highly recommend,5,True,1,2016-05-07
13207,Great tablet for my grandson.,I will definitely purchase another tablet a larger size for me at a different time.,4,True,1,2016-05-07
2907,Great starter tablet,This Kindle makes for a great beginner tablet for a teenager. The only complaint is that it is a little laggy but great for the price.,4,True,0,2016-05-07
82410,Good,The screen is Crack already with the kids proof case,3,True,0,2016-05-06
61810,Great tablet for kids and anyone else,I am extremely happy with my Kindle Fire. The price was fantastic. Functionality is great. I am very pleased with this tablet,5,True,0,2016-05-06
69213,great for kids,Great for children to play games and watch videos.,4,True,0,2016-05-06
48613,Good value tablet,Pretty good value tablet. Works like expected and has some good apps. Only downside with memory at 8gigs.,4,True,0,2016-05-06
28013,Perfection,No problems my daughter loves it we used rewards points and got the warranty,5,True,0,2016-05-06
86916,Like it,Just got my kindle and am just getting use to it. Like it so far.,4,True,0,2016-05-06
56016,Great begginer,Bought for my son.. He really liked it for a starter tablet,3,True,0,2016-05-06
4516,Good buy,Good buy nice screen great battery life quick good video quality,5,True,0,2016-05-06
63419,great,Got this for my granddaughters birthday and she loved it so my other granddaughter wanted one so I brought another one and they both loved them,5,True,1,2016-05-05
1619,Good stuff,Got the Amazon fire tablet for my daughter n she loves it. It had some good games n learning stuff on it n she needs that at the age of 4.,4,True,1,2016-05-02
39922,Great radio,This radio was bought at and then installed at Best Buy. They did an awesome job and it works great.,4,True,0,2016-04-30
29622,great for kids,my son loves it. We have a lot of games and education games also.,5,True,2,2016-04-30
19322,tablet,bought as a gift and they loved it. it works fast and good,5,True,1,2016-04-30
88525,great tablet for the price,very good entry level table for the money. it works very well.,5,True,2,2016-04-30
37025,Updated unit,Great new tablet as always due to new techknowledgy,5,True,2,2016-04-30
16425,Great for my grandson,Great tablet Easy for a child to use Price is right and size,5,True,1,2016-04-30
85628,A great tablet for a good price,Whenever I see an item in the store and the price seem a bit cheap I begin to get very cautious. I ask many questions of other users. Thankfully after having bought this kindle for my nephew he and I have been elated ever since .,5,True,1,2016-04-30
65028,Good Tablet,Great for young children and beginners. Has all the basic features needed to enjoy this tablet,5,True,1,2016-04-29
34128,Great,Right price my son loves it great for games and you tube,5,True,1,2016-04-29
23828,A good tablet at an affordable price.,Works great. No issues with it since I bought it a month ago. A good beginners tool for someone buying their first tablet. A great value at a reasonable price.,5,True,1,2016-04-29
3228,Good tablet,Like the tablet wish it had better battery life the older kindle battery life was amazing,4,True,1,2016-04-29
93031,Great Product,My grandson is totally in love with his New Fire Tablet. He had an older version and was grateful for the upgrade.,5,True,1,2016-04-29
72431,Great product for a great price,We already had one Amazon fire tablet and liked it so much that we decided to purchase another for the grandkids to use when they come over.,5,True,1,2016-04-29
62131,games are challenging,I enjoy the games and Internet access on the Amazon tablet.,5,True,1,2016-04-29
20931,Love the ease and display. Good battery.,The fire is a very inexpensive tool and toy for those of us just startuing to explore the world of diwloading.,5,True,1,2016-04-29
90134,Great Tablet and Price,Very good tablet at a great price. Nice size for all applications.,5,True,1,2016-04-29
79834,Nice little tablet,I find reading books on this tablet to be better than expected despite the shiny glass display.,4,True,1,2016-04-29
69534,Nice tablet for everyday use,Nice tablet will seriously think about getting a second one.,5,True,1,2016-04-29
56337,great value for money,This is a great product. Easy to navigate and use with Wifi.,4,True,1,2016-04-29
46037,easy to use the kids love them and they are afford,This is the second one we have purchased and we really enjoy it.,4,True,2,2016-04-29
35737,Allego good,It was a great purchase and I love the way it works,5,True,1,2016-04-29
15137,AMAZON TAB,THIS ITEMS IS READING USING IT FOR READING AND LITE SURFING,5,True,1,2016-04-29
4837,Tablet,Great speed and fAst great for kid and teens Upgrades easy,4,True,0,2016-04-29
32840,Good pruchase,It work just as good as the tablets that cost much more. If you take care of it it will last a long time.,5,True,1,2016-04-25
1940,Solid Purchase,Just using this for music so it does what I need it to do. Would give 5 stars but it falls asleep faster than I would like it to.,4,True,1,2016-04-26
91743,Great Tablet,I got this tablet for my 6 year old daughter and she loves it,5,True,1,2016-04-25
60843,Great tablet for college student,This tablet is great for using ebooks as a college student,5,True,1,2016-04-25
88846,Great for a little reader.,This reader is great for consuming your digital media on the go. With a few tweaks it is quite a function tablet for cheap.,4,True,0,2016-04-23
78546,tablet for my daughter,Great tablet for the price. Surfs Web well.great for her to watch netflix on,4,True,0,2016-04-23
57946,Great tablet for kids,I bought kindles for my twins last November and I loved this product so much that I purchased them for my triplets for their birthday.,5,True,0,2016-04-23
37346,kids love it,has all the apps and functions the kids will ever want..,4,True,0,2016-04-23
75649,great tablet,I needed a 2nd tablet and this was a great purchase.,5,True,0,2016-04-22
44749,Fire tablet 7,Great tablet for kids. They just love how simple it to use and great price.,5,True,0,2016-04-23
3549,Perfect for the kids.,I have bought 8 of these. They are perfect for kids,5,False,0,2016-04-23
31552,The kindle fire is amazing and cool,The best part of the kindle is a lot of the games are free.,5,True,0,2016-04-22
90455,Great product,Easy to use and update. Great for kids and adults alike.,5,True,0,2016-04-21
80155,Great for kids,Bought two for my kids they love them. Great for the price.,5,True,0,2016-04-20
59555,Affordable reader tablet,Pad 50 bucks for this tablet and have been happy with it used a an internet reader. Can play video with some lag and buffering,3,True,0,2016-04-20
8055,Good product,This is a good product for the price easy for kids to use,4,True,0,2016-04-22
84661,Great little tablet,Had a Google Nexus which I really liked but started having issues with the power connection. After replacing the USB connector I still had issues with it so I decided to replace it. Did my research and purchased a Kindle Fire and loved it so much I bought two more to give to my parents.,5,True,0,2016-04-20
64061,Great,I got this for my teenager and she loves it. The only hard part was getting it set up for her without giving her access to my account,4,True,0,2016-04-20
53761,Great beginner tablet,Purchased as a gift for a family member who just wanted to be able to watch videos and play games while his wife shopped. Wonderful beginner tablet and no issues so far. Very user friendly.,5,True,0,2016-04-20
61164,Excellent product,I bought this as a gift for my moms birthday and she loves it. The screen size is just right and it really fast for the games she plays.,5,True,0,2016-04-20
50864,Great ereader good tablet,Purchased as a gift for teenager. Love that it encourages her to read and lets her do other light web.,4,True,0,2016-04-20
40564,great tablet,great tablet for the price easy to use and came very quick,5,True,0,2016-04-20
19964,Great gift,Perfect for a graduation gift when you are unsure of what the person finds interesting.,5,True,0,2016-04-20
99467,Great,My husband needed a new kindle and he can do so much with it.,4,True,0,2016-04-20
47967,Alternative,Great to travel with . Overall it is user friendly.,4,True,0,2016-04-20
6767,Love the Amazon Kindle,This is the second one I have bought now. Quick delivery and service is great as always,5,True,0,2016-04-18
96570,Great Tablet for the price,This is a great little Tablet for the price. Easy to use.,5,True,0,2016-04-18
24470,Great Product,I love this kindleGreat for adults and kids.Fast processor for price.,5,True,0,2016-04-18
3870,Great value,For the price hands down best tablet out there. Excellent for reading in bed without disturbing your partner thanks to the blue shade mode.,4,True,0,2016-04-17
93673,Very affordable and good tablet,Bought this for my son who enjoys watching videos and listening to music. Good quality tablet and good screen.,4,True,0,2016-04-17
52473,they are great,i liked mine so much i bought another this one for my granddaughter,5,True,0,2016-04-17
59876,Great tablet.,I really like my kindle. I do wish it had so that you could move books that you had read to another area or just mark them as read. I read a lot and sometimes forget if I read the book. It holds so many books and I can take them all anywhere.,5,True,0,2016-04-16
28976,Good,Love my kindle. It work so good i take it everywhere i go,5,True,0,2016-04-16
98179,Price is right,Great product for the price. Has everything my child needed. I recommend it for starters,5,True,0,2016-04-16
87879,Kids love it,Got these for the neices and nephews they love them.,5,True,0,2016-04-16
77579,great tablet for kids,My daughter loves this and.enjoys the free books on AmaZon,4,True,0,2016-04-16
5479,Great product for adults and kids,Images quality better than l had imagine. Good for games and easy to download games on Amazon . My son love it.,5,True,0,2016-04-15
74682,Love it,My kids love their new tablet Easy to use for them and myself,5,True,0,2016-04-15
64382,Excellent,Really fast small and easy to store away and I always use it at work.,5,True,0,2016-04-15
92385,excellent for everyday use,This product is great. The customer service is great,5,True,0,2016-04-15
82085,It was affordable,It was affordable and it works great I hope it stays that way,5,True,0,2016-04-15
61485,Easy to use,It was very easy to use. My grandma was able to figure it out with no problem,5,True,0,2016-04-15
51185,easy to use,i have never used this product before found it to be very easy,5,True,0,2016-04-15
40885,You get what you pay for,I was really hoping for this to take place for my phone with my kid. It did not. It works decent to stream videos.,3,False,0,2016-04-15
30585,Great little Kindle excellent buy,This little Kindle was worth the money for sure. I would tell all my friends to buy this because of the great price that it is.,5,True,0,2016-04-15
17388,Good for the price,Tablet works wells for easy reading. It is also very lightweight.,3,True,0,2016-04-15
86591,Great for older generation,Great tablet for a beginner Tablet being used by older,4,True,0,2016-04-15
76291,Perfect for young people,This is s good inexpensive tablet that works well for young folks.,4,True,0,2016-04-15
65991,Lots of Great Apps,I bought this item to catch up on my book series which was easy to find with the built in amazon book store app. It also has great apps for games and anything you are looking for. I definitely recommend this. its a great deal at a great price.,5,True,0,2016-04-15
45391,Great for the price,bought this as an upgrade for my 9 yr old son from his Nabi and he loves it,5,True,0,2016-04-14
4191,love this tablet,this is a perfect tablet for our 10 year old so he can play games,5,True,0,2016-04-13
63094,Very convenient,Easy to use and convenient when you need to check or look something up quickly. The low price was a good incentives to try this product.,5,True,0,2016-04-11
1294,Good for Children,I purchased the tablet as a gift for my children. It was very cost effective and works great for their needs.,4,True,1,2016-04-10
80797,nice tablet,Nice tablet for the price. Screen is very clear. Tablet makes Amazon Prime more enjoyable.,5,True,1,2016-04-10
60197,Fire tablet 7,Got it for my daughter. Great tablet. It replaces a fire HD 6.,5,True,0,2016-04-10
39597,Good basic tablet,Good tablet for my wife to use for social media and looking up items for remodeling our house.,4,True,1,2016-04-10
88200,Good little tablet,I have enjoyed these little tablets and now they come with the micro sad card port making it better,5,True,0,2016-04-09
67600,GREAT TABLET FOR MY DAUGHTER,GREAT TABLET FOR MY DAUGHTER And she loves it so very much...Thanx again Best Buy...,5,True,0,2016-04-15
16100,I can read downloaded books without being on WiFi.,I love that there is a free writing app that resembles Word and I can type documents which can be saved to Dropbox directly from the app.,5,True,1,2016-04-09
23503,Alright,Its ok but the chargers brake easily but overall its the best,5,True,0,2016-04-08
92706,Love this tablet.,We had one and it was broken so I purchased another one.,5,True,1,2016-04-08
