review id,review title,review text,review rating,review do_recommend,review num_helpful,review date
45728,Excellent,I got this for a friend so she could use the internet and have more entertainment. I was happy with the cost.,5,True,0,2016-06-03
35428,Great product,Definitely got the job done. This tablet is nice size and affordable,4,True,0,2016-06-03
14828,Get for books,Got it for my wife but I keep it. Got to get her one now.lol,5,True,0,2016-06-03
4528,Great Tablet at a Great Price,Bought this tablet for my kids and they love it. The Fire allows them access and freedom to a tablet without the high cost.,4,True,0,2016-06-03
84031,kindle fire 7,Love the kindle products. I bought the original kindle years ago so this is a nice upgrade.,5,True,0,2016-06-03
53131,not bad for the price,good starter tablet or great for games. fits in the purse or coat jacket.it was on sale for 50 dollars,4,True,1,2015-11-26
42831,Great tablet,My daughter had been asking for a tablet she loved it and since likes to watch movies and play games and take a bunch of pictures i like that you can expand the memory up to 128 gigs.,5,True,7,2015-11-26
11931,Great for my 8 year old,It does every thing I need it to do for my son. It is very helpful when we are doing homework.,5,True,5,2015-11-24
91434,Amazon Kindle,THESE WERE BOUGHT FOR YOUNG BOYS. SO FAR NO PROBLEMS. VERY DURABLE. VERY CAPABLE.,5,True,10,2015-11-24
70834,good starter tablet for our young grandson,Santa brought it for our our grandson. We got a shock case for it and he plays and watches kids videos on it every day while his older siblings are playing games on theirs. It was a little money well spent on a kids tablet.,4,True,0,2017-04-04
39934,Slow slow slow,Very slow.My 73 year old mother loves it.I would recommend this to a elder or a young child.,3,False,0,2017-04-03
9034,Great inexpensive tablet.,Bought it for a friend for Christmas. They like it and use it everyday. Definitely recommend it for others.,5,True,0,2017-04-02
88537,great tablet for teenages,This is a great tablet for kids to uses for downloading games and using the internet.,5,True,0,2017-01-30
78237,great gift,great tablet for the price. excellent gift for anyone,5,True,0,2017-01-30
67937,Great item works awesome,This tablet was amazing I love that I can add memory with a memory card.,5,True,0,2017-01-29
57637,Cannot evaluate it.,I purchased this for a child on the angel tree for Christmas.,5,True,0,2017-01-29
47337,Great for Amazon users,Works flawlessly with amazon users especially those with prime accounts.,5,True,0,2017-01-29
44440,My daughter loves it .,I found this item to be very useful for my daughters learning programs .,4,True,0,2017-02-24
34140,Great Buy,I find that this is the perfect size for reading. Great price point.,5,True,0,2017-02-24
13540,Nice tablet for kids,This has been a good tablet for my daughter to use for entertainment and for learning.,4,True,0,2017-02-23
82743,Love it.,I previously owned the kindle fire hd 8.9. I wanted a smaller tablet and this one is perfect. I use my kindle for books only and I have more than enough room.,5,True,0,2017-02-22
41543,Works perfect for young boy,Bought this for our 8 year old boy. Nice to have a micro sd slot. The processor seams a little slow. But seems to work sufficient enough for him. Great parental controls.,4,True,0,2017-02-24
10643,Great Tablet for the price.,I am very satisfied with my Kindle Fire. I am amazed how good it is for the price. I am visually impaired and the voice over is excellent.,5,True,0,2017-02-24
90146,Great for beginners,Easy to set up and very simple to use.very light and compact.,5,True,0,2017-02-24
59246,Excellent tablet for the money,This is one of the best buys for the price. Amazon outdid themselves with this one for what you get for the price. This is an excellent gift.,5,True,1,2015-11-14
38646,Great for any ages.,Given me many hours of pleasure. Really enjoy the jigsaw puzzles.,5,True,1,2015-11-14
28346,Great table for the price.,Works very well. Much better operating system than other cheap tablets. It has a quality feel as well.,5,True,2,2015-11-14
46049,Great Tablet,Love this tablet. Has all the best features of a kindle and a regular tablet. It is easy to use and does exactly what it is supposed to do with zero fuss.,5,True,7,2015-11-17
35749,Great for basics,This tablet is a steal at this price. I would dare say it offers more per dollar than a high end tablet.,4,True,7,2015-11-16
43152,Great starter tablet,I have had this tablet for about a month. It is really good for basic use. It met my expectations.,4,True,0,2015-12-12
81455,Great device at a great price,I have bought tablets for others but this is the first time I bought for myself. This is a great price for a device that does everything.,5,True,1,2015-12-13
71155,Meeting the need,I got this for my son. He is reading more now that he download the books to his tablet,4,True,2,2015-12-13
60855,Great First Tablet for beginner,Found this tablet to be user friendly and easy to handle. This was purchased for and elderly individual who is enjoying it very much. Battery life is not long enough though.,4,True,5,2015-12-13
29955,Great for kids,Purchased for my son works great and great price..,5,True,1,2016-01-18
19655,Good tablet,This was bought as a Christmas present for my other half. She is enjoying it very much and it is user friendly,4,True,1,2016-01-18
9355,Great tablet to have,I needed a tablet...and it came in handy...just what I needed.,5,True,1,2016-01-18
88858,great tablet for the price,I was pleased with features of this low cost device,5,True,1,2016-01-18
78558,Compact with a good size screen,This ereader is more like a tablet or iPad but without the huge price. Loving my new tech toy.,5,True,0,2015-12-29
27058,Best for the price,Got it for 35 on BF.. the tablet is very good ..the processing speed and eveything. The only bummer is Camera but dont use it much,5,True,0,2015-12-29
55061,Greate steaming device,This is great to turn an ordinary tv that has an HDMI port into somewhat of a smart tv.,4,True,0,2015-12-29
13861,better than before,The Picture awesome. Memory card can be installed.,4,True,0,2016-12-25
93364,Great gift,Easy to use at any age level. Should of got another one,5,True,0,2016-12-25
72764,Excellent tablet,Purchased this for a Christmas gift for my nephew. He loved it. Very nice tablet at an affordable price.,5,True,0,2016-12-25
52164,Great tablets for my Grandkids,My grandkids like to use my tablet when they come to visit. I bought them each one for at home.,5,True,0,2016-12-25
41864,Good so far,My wife just opened this for Christmas. She is enjoying it so far. Looks and operates as good as any we have seen recently. So far so good.,5,True,0,2016-12-25
28667,Great item for the price,Got it as a Christmas present. Recipient enjoys It very much.,5,True,0,2017-01-23
18367,Inexpensive tablet,Good inexpensive tablet. I use it to control my E series vizio and andriod box. Apps open slower than on my Galaxy S7 edge but other than that everyting works as expected. Note that google play store is not available without modification,3,True,0,2017-01-23
66970,Best Buy for your money,It is inexpensive so you can get many of them. It also has a speaker.,5,True,1,2016-03-19
25770,Great bargain,I got one for Christmas and loved it bought this one for my son and he loves his,4,True,1,2016-03-19
5170,Great,Great little tablet perfect for reading books and listen music,5,True,0,2016-04-22
94973,Great product,Easily accesible wonderful for my kids stays charged long time,5,True,0,2016-04-22
43473,Great for kids gaming,My children love playing their games on this tablet. It works well.,4,True,0,2016-04-22
71476,Great price for this tablet,Tablet bought for a 10 year old child. Perfect pricing for a lot of tablet. Great pricing and good product.,3,True,0,2016-04-22
99479,purchase for grandkids,purchased for grandchildren easy to use they love it,4,True,0,2016-04-24
47979,Nice,This is a nice small tablet. Works well and great with Amazon products. A great price.,4,True,0,2016-04-24
37679,Great tablet,I was worried with the smaller screen but it really is great. I have had no issues.,5,True,0,2016-04-24
17079,Gift for a 9 year old,I have purchased this item for 3 grandkids to date. Exactly does what it needs to do.,4,True,0,2016-12-02
6779,Great as a gift,Bought it for my mom and she loves it. Easy to use.,5,True,0,2016-12-01
96582,Good Product,Amazon Product is good and it is handy. It is useful while travelling.,5,True,1,2016-12-01
86282,Great when you have company or when you alone.,Entertainment or the quiet times you love. Perfect,5,True,1,2016-12-01
34782,Tablet,Great beginner tablet. Used for my kid to view videos.,4,True,0,2016-12-02
24482,Quality tablet for a great price,This is a well made tablet that has many great features.,5,True,0,2016-12-02
14182,Great pad for my 10yr old son,My 10yr old loves it . He stays on the pad for hours and never get bored ....,5,True,0,2016-12-02
73085,if using just to read books it is great,I got very good customer service explaining the difference in tablets and Kindle Fire is what was suggested to me as all I want to do is use it as a ereader.,4,True,0,2016-12-02
52485,Great buy,Caught a Black Friday sale and was worth every penny. Does all the essentials with a great picture for videos.,4,True,0,2016-12-05
21585,Nice tablet,Nice tablet for the price. I wish the colorful ones available in the store.,4,True,0,2016-12-04
11285,Great small tablet,Tablet is great for 7 inches. Touch screen works great,5,True,0,2016-12-04
80488,Great for reading on the go,Love it. Really light weight so easy to carry in my purse and read books on it during my daily commute on the train,5,True,0,2016-12-06
59888,love amazon kindle,i have bought at least 6 people this kindle it is perfect......,1,True,0,2016-12-06
77591,Great tablet,I would like to buy this because it caught my attention.,5,True,0,2016-12-07
54094,Good cheap tablet,You could pay more and get something better but for reading comics and watching YouTube this is fine,4,True,0,2016-06-05
33494,Great tablet for the money,For the price this is a great little tablet. Its fairly fast and fits my needs.,5,True,0,2016-06-05
23194,Best tablet for a little money,Light weight user friendly tablet. Does everything that expensive tablets do and more.Best value for the money.,5,True,1,2016-08-21
12894,Not for me.,It came with dead pixels so i was very disappointed. i called then they replaced it. I ended up returning it completely because it was too slow.,2,False,0,2016-08-21
61497,Great reading device,The device is good for reading on. It feels like reading a book.,5,True,2,2016-08-20
40897,Great Tablet,Tablet is great for the price. Not as fast as my S7 but pretty darn good for the price.,4,True,0,2016-08-26
38000,Value for the money I have spent,This is the first tab my niece is using and she is just loving it,4,True,0,2016-08-26
17400,Great price,Exactly what I was looking for inexpensive and great for my little one. User friendly.,5,True,0,2016-09-02
24803,Nice,Pretty basic tablet that suits me since im not really looking for something to do with it other than play or browse the internet,5,True,0,2016-09-04
94006,Good Tablet for the price,This was on offer for thanksgiving. I just bought it just as a second tablet to iPad. have to say it is good. .,4,True,0,2015-12-31
63106,Worth the price,This was a replacement Kindle for our grandson. loved it,5,True,0,2015-12-31
70509,Good for reading,I bought 2 for my kids for reading and they are slowly but gradually picking up how to use them. They thought I bought it to download games. I told them one game each and the rest books.,4,True,0,2015-12-31
60209,The tablet works very well.,The screen is clear and battry last for 8hr. The camera is easy to use and can been taken for good pictures.,5,True,0,2015-12-31
29309,Great for a first tablet,Great for a first tablet. Needed something larger than my phone and it comes in handy when the grandkids visit.,3,True,1,2016-01-01
19009,Great tablet,Great tablet and very cheap. Used to for gift for customers and ita amazing,5,True,0,2015-10-16
36712,Good Product,I am currently using this item. It is very good product.,5,True,0,2017-03-30
16112,AMAZON TABLET,I replaced my old tablet with this one. I like this tablet because it has a back light and I can read in bed without disturbing anyone else.,5,True,0,2017-03-30
5812,This is an ok Kindle for the price,The Kindle works as it should and was inexpensive but has a short battery life,3,False,0,2017-03-30
75015,i love the set up,it is set up way more like tablet then then the old kindles,5,True,0,2017-03-29
64715,Great starter tablet or for those on a budget,I purchased one a few weeks before purchasing this one. SD Card slot cover broke when trying to insert card. Decided to get another one. This one is fine. Have to use tape to hold other one in.,4,True,0,2017-03-29
54415,Kid friendly,Bought it for my cuz lil boy he likes it very much.,5,True,0,2017-01-25
23515,great for the price,I purchase this as a gift and the recipient is happy with it,4,True,0,2017-01-25
13215,Great for price,you couldnt really expect anything more from a device so cheap compared to other tablets,4,True,0,2017-01-25
61818,It was a great product,It was the easiest tablet to use. I bought about 5 of them and it was good for traveling.,5,True,0,2016-12-10
41218,Small and compact,This is a small and compact device that is easy to use,5,True,0,2016-12-10
20618,Great item for the price,It is small enough to carry along on my daily routine. The price was right too.,5,True,0,2016-12-10
89821,Good buy,purchased this item for my 7 year grandson he loves it,5,True,0,2016-12-14
97224,Great Value,This is a nice item. I recommend this to everyone.,4,True,0,2016-12-14
86924,Great tablet,Got tablet for my son as a Christmas gift. He will enjoy it as I have one myself,5,True,0,2016-12-14
76624,Great product,Would recommend this product to anyone looking for a tablet.,5,True,0,2016-12-14
14824,Great buy,Excellent for browsing and reading. Good price for great quality.,5,True,0,2016-12-27
11927,Bang for the buck,Tablet is very well built for 49.99 . Only issue is the speed of the processor,3,True,0,2016-01-04
1627,Great gift for anyone,I bought this for my dad. works great for a novice that just needs basics,5,True,0,2016-01-04
91430,Kindle Fire Tablet,This is my daughters second purchased kindle..great product for reading games and searching the web..durable and affordable.,5,True,0,2016-09-02
81130,Good Price and tablet for child,Bought for lil brother its a ok tablet for a kid especially apps like WWE and cartoon,3,True,0,2016-09-04
70830,Great Value,This is a great value. Comfortable size for reading.,4,True,0,2016-09-04
29630,Great tablet for price.,Works great.Terrific tablet for price.Would definitely recommend this tablet.,4,True,0,2016-09-03
98833,Perfect Tabletfor kids,It works perfectly and I like it . I might get another one for Christmas gift,4,True,3,2015-11-21
88533,Excellent product for the price.,Very satisfied useful for internet and email. Will continue to use this brand.,5,True,1,2015-11-21
78233,Great for the older user,Easy to use when traveling. Has all I need and is fast and covers my needs.,5,True,0,2015-11-20
57633,TABLET,I purchased three tablets and the grand children have been using them every day and they are working great and just the one that they needed. They are easy for them to use and even this grandmother can work them and that is a plus for us.,5,True,2,2015-11-20
37033,Great tablet my Neice love it,I would recommend this to anyone it quite compact and easy to use and it good for any age.,3,True,1,2015-11-20
16433,best tablet value,picked this tablet up for my wife had a bad experience with other cheap tablets bought this one and have absolutely loved it best value out there,5,True,3,2015-11-21
13536,Very Good,This is my first tablet. It is simple to use and very efficient.The only thing that I would have liked would be larger keys on the key pad. Other than that I am very happy with it.,4,True,4,2015-11-22
93039,Nice product,Easy to use. Has a nice clear picture.comes with some good apps.,5,True,3,2015-11-21
82739,great tablet,Love the tablet. Great reviews for the amazon kindle,5,True,1,2015-11-21
51839,Easy to use,My kids love it . I love the size and weight . It not easy to broke or crack,5,True,0,2017-03-16
31239,Nice gift for the kids,I bought these kindle fire tablets for Christmas presents for the grandkids... They love them. Good durable tablets at a great price.,4,True,0,2017-03-16
339,Great tablet for young kids,Stay charged for a long tine. Prefect size for young kids.,5,True,0,2017-03-16
48942,Good tablet for kids,I bought this tablet for my grand kids. They really enjoy it.,4,True,3,2015-11-21
18042,Christmas gift,Was a christmas gift for my daughter she loves it.,5,True,0,2017-01-23
7742,Very happy,It was a gift to our granddaughter for Christmas and she was and is thrilledwith the device. She especially will use the Geek Squad information service.,4,False,0,2017-01-23
66645,Excellent product for the price,I bought one of these tablets for my 5 year old son and he loves it. Very user friendly and many options of games and apps for free at Amazon.,4,True,0,2017-01-23
56345,Ok,Good for kids good for reading not good for much else,3,False,0,2017-01-23
46045,Great Kindle fire,This is just perfect for my tween boy. It is easy for him to use and play games on while we are driving in the car.,5,True,0,2017-01-23
25445,Good tablet for games,This tablet I use for reading as well as free games.,4,True,0,2017-01-23
15145,Great for a kid,This was a gift for my son he loves it great price point for an entry level tablet,5,True,0,2017-01-23
4845,Good tablet for the price,Good product for the price. Screen resolution is decent. Love the external memory card slot.,5,True,0,2017-01-23
84348,Nice tablet,Bought for my 14 year old son for Christmas. He likes the Amazon fire and using frequently...primarily for playing games. My husband has had one for several years and uses it every day.,4,True,0,2017-01-23
63748,Great for all ages,Bought the tablet at a great price. Wish i would have gotten more,5,True,0,2016-12-23
32848,Great tablet,It is a great tablet for its price. I would recommend,4,True,0,2016-12-23
22548,Tablet,Price is great and my 6 year old LOVES it. Overall perfect.,5,True,0,2016-12-23
81451,Awesome tablet,Great tablet everything i wanted in a tablet thanks,5,True,0,2016-12-23
71151,Love the tablet. Great for the price,Its an excellent tacky for the prices. It works well and the picture quality is excellent.,5,True,0,2016-12-23
50551,Christmas gift,its a christmas gift so have not even opened it yet,4,True,0,2016-12-23
19651,Ok for the price,Does what you would expect for the price. Not a spectacular device but it gets the job done.,3,True,0,2016-12-23
9351,Good,Good solid tablet for the price. Does alot of things,4,True,0,2016-06-18
99154,VERY NICE TABLET FOR THE MONEY.,REASONABLY PRICED. HAS MANY FEATURES OF TABLET COSTING MUCH MORE. DAUGHTER REALLY LIKES IT.,5,True,0,2016-06-18
57954,Great for reading and gaming,Small and compact but great for reading books and gaming. Will try Netflix down loads next.,5,True,0,2016-06-18
27054,Great tablet for light use,I purchased the tablet for my mother in law to use to read ebooks and play online games. It was very user friendly and a great price and product for our needs.,5,True,0,2016-01-06
16754,Xmas gift,Gave this to my son for Christmas. He loves it. Speed is good for what he does and battery life seems good enough for him.,4,True,0,2016-01-06
24157,Very handy,Very useful to keep my little cousins occupied with educational games,5,True,0,2016-01-06
93360,Great for the price,Tablet runs well and the form factor is decent for such a cheap tablet.,4,True,0,2016-01-06
31560,Awesome Starter Tablet,Bought this for my father as he is in his 60s and never had a tablet before. He loves it and it works for all his needs.,5,True,0,2017-03-04
90463,Great gift,I give 1 of these put every month at work. It normally goes to their kids so they are the awesome parents.,5,True,0,2017-03-04
59563,Great tablet for children,This tablet works great for my 7 year old son. He loves it. The app store has plenty of apps. I would recommend.,5,True,8,2015-11-23
28663,nice for general use,I bought this for my niece and she seems to love it. Great for netflix and playing games. Of course you can also read books just like all kindles.,5,True,8,2015-11-23
18363,Best at its price,Best at its price. Just bought it because its less when compared ot other leading tablets. good for Skype.,3,True,4,2015-11-23
87566,It serves all my needs.,It works great for all like to surf on the internet.,5,True,1,2015-11-23
77266,Great for my grandson,I purchased this along with the kids version for my two year old grandson this one stays at my hose the Kids version at home with his parents he loves it,4,True,1,2015-11-23
46366,Good deal,This is a good tablet for the money. Recommended for first time tablet owners.,4,True,3,2015-11-22
43469,Great for the price,I AM LIKING IT SO FAR JUST FOR BASIC USE. READING AND SOME WORK VERY LIGHT. GOT A WIRELESS KEYBOARD TO GO ALONG WITH IT EASY TO CONNECT. NO problems very happy.,4,True,1,2015-11-20
33169,Great value,I purchased this Amazon Kindle Fire for my mother. She is new to technology and loves this tablet.,4,True,1,2015-11-20
12569,simple tablet,Easy to use. Great for someone who wants to play some games and use simple apps.,4,True,1,2015-11-20
92072,My 2nd One,I like it for the price but did notice some flaws.,4,True,1,2015-11-20
81772,Very easy to use,I bought this product since my wife purchasers a number of books from amazon. We also wanted easy access to our emails.,4,True,1,2015-11-20
50872,Good overall product,Good small affordable tablet gets the job done very nice.,4,True,1,2015-11-20
30272,Ok for child,Did not care for this product. Had difficulty downloading some Aps.,3,False,1,2015-11-20
19972,Great for my sons therapy,My son uses it in his therapy to track his program. It is the perfect size.,4,True,1,2015-11-20
99475,No netflix support,Sadly no having netflix support is resulting in my last tablet purchase from Amazon.,2,False,5,2015-11-20
83381,Love it,I got it for my son he loves it very good for travel,5,True,1,2015-11-20
73081,Great tablet. Great price.,This is a nice tablet. It has a really good clear screen.,5,True,1,2015-11-20
42181,Great for a tablet nooby,As a tablet noob this was the perfect tablet to start with simple to use and even simpler to understand. I like every thing about it now I want a larger screen.,5,True,4,2015-11-19
31881,Great for kids,Bought it for my nephew and he loved it. Great purchase,4,True,5,2015-11-19
981,amazing,great tablet for the size. will be giving this to the kids from santa this year.,5,True,2,2015-11-19
70184,Great Price,I bought two of these for my daughters. Works great for the kids and if they drop them and break your not out a huge chunk of money like you would be for an IPad.,5,True,3,2015-11-18
59884,good tablet,Download is slow but after its on the tablet. It works great good buy,4,True,4,2015-11-18
87887,Cute little tablet,Did what I needed it to do took back to get a bigger size,3,True,1,2015-11-18
46687,Good Product,No issues with the product. I am a satisfied customer.,5,True,4,2015-11-18
26087,Easy tablets to use for Amazon lovers,It is easy to set up and easy to use. You can use it to watch videos from the Amazon Prime video or listen to music with the Amazon Prime music or read on the Kindle. Great value for everything you get.,4,True,1,2015-11-18
54090,Decent Quality,Better quality then most tablets in same price range. I still suggests the accident protection plan or at least a okay case for it. Ads on lock screen is a bit of a let down but it functions like its supposed to.,3,True,3,2015-11-14
43790,great for reading and for kids,Great value. My kids love it and use it often. Really helps them with homework.,5,True,1,2015-11-14
12890,Great for the price,I bought this tablet for my wife. The Google app store and 8 gigs of memory were just what she was looking for.,5,True,1,2015-11-13
82093,Great purchase,Love it the size easy to carry and store would recommend to others,4,True,2,2015-11-13
71793,Great gift,Person really likes the gift. Says it is ideal for his needs and then plus. Easy travel size as well.,5,True,1,2015-11-13
61493,Awesome for all ages,I bought this for my son who has a speech disability. He uses it to communicate as well as play games. Great parental controls,4,True,6,2015-11-13
51193,Ok little tough stay away from the Amazon apps,App selection is very difficult too much Amazon sales have not been able to get my Reward Zone points tried to purchase app but was unsuccessful,4,True,0,2015-11-13
40893,Great tablet,It works well my granddaughter loves it she plays on it everyday,5,True,1,2015-11-13
79196,Great tablet for reading.,Friendly user for kids enjoyed being able to read books.,4,True,8,2015-11-07
48296,perfect tablet for a child that loves to read,My 10 year old granddaughter loves to read. She can now download books from the local library as wall as other websites. This is a wonderful tool for a child that loves to read,5,True,2,2015-11-13
27696,Good and cheap tablet,And now I say cheap but not in the pejorative sense. Good price and with great functionality. Many uses. Reading. Surfing the web. Games. Love it all.,5,True,4,2015-11-11
7096,For the whole family. Simple to use.,I love it. Good Camera and perfect for surfing the web.,5,True,2,2015-11-11
24799,Nice tablet,I bought this to test before I bought more as Christmas gifts for my grand kids. Seems to work fine,4,True,1,2015-11-13
