review id,review title,review text,review rating,review do_recommend,review num_helpful,review date
62151,Great item,This is a fantastic tablet. I take it to workAll the time.,5,True,0,2016-01-04
20951,Good,Good for beginners. My staff really liked this treat for christmas,5,True,0,2016-01-04
10651,Great Product at a good price,Gave this as a gift. Grandson loves it. We liked the low price.,5,True,0,2016-01-30
351,Fast and simple,My step son never really used a tablet before and he has no problem picking this up and just using it.,5,True,0,2016-01-30
79854,Great tablet for the kids,This tablet works wonders great price my grandchildren love it . My granddaughter love downloading books my grandsons enjoy the games.,5,True,0,2016-01-30
69554,great camera for a beginner,For an android powered device and no google support it works alright,5,True,0,2016-01-30
38654,Also got these for Christmas.,Bought for kids like how sturdy they are my son has dropped his twice and it must keeps on going. Also. Added Amazon prime which is a great deal.,5,True,0,2016-01-30
97557,Cheap tablet,A cheap tablet that is a very good bang for your buck.,5,True,0,2016-01-31
46057,I love this item,Great item for a fraction of the price of an ipdad,5,True,0,2016-02-03
15157,Great Tablet for the money,Good deal. I recommended this tablet to several family members.,5,True,0,2016-02-03
84360,Really enjoy this for reading books.,Great to use and I like the larger screen. It is fast and easy to use.,4,True,0,2016-02-05
74060,Product wasnt good,The tablet stop working after the second week. I couldnt find the receipt to return it. Its just beenCollecting dust,2,False,0,2016-02-05
63760,Great product.,Amazon did a fantastic job. I gave it to my father as a Christmas gift and he loves it.,5,True,0,2016-02-05
22560,Great for price,You get what you pay for. The camera is terrible but I bought it for games and reading. The ads can get annoying but for what I paid for its a good product,4,True,0,2016-02-05
91763,Kids love it,The screen is clear and great for playing games and watching videos.Doing homework is easier,5,True,2,2016-02-07
60863,Great Tablet,I bought the fire for my grandson and he loves it.,5,True,1,2016-02-06
57966,Good device for the price.,My granddaughter really loves it. She was so anxious to start using it.,5,True,1,2016-02-08
85969,5 star device crippled by amazon,This device would be the best possible tablet for the money if it had Google Play. However Amazon chose to block access to it. This took their well made tablet with a beautiful screen and great performance from an amazing value to a waste of money. This is my last amazon branded product.If you use a lot of apps or want specific apps shop for another device.,1,False,20,2016-02-14
65369,great upgrade from earlier kindle,gave my dad my kindle two years ago and at xmas time i loved the price and upgrades of camara and sd card,5,True,1,2016-02-14
13869,Amazon Fire,The Amazon Fire 7 inch turned out to be a good deal. The screen resolution is better than I thought. The battery is very good.,4,True,1,2016-02-16
83072,Perfect intro tablet,Great tablet for the money. Good way to see if you prefer a tablet or a laptop without spending a bunch of money to find out. Works good to stream movies or surf the web.,4,True,2,2016-02-15
72772,Good Tablet for a beginner,This is a good product for the price. It does do the basic things right. It however would need a bunch of features to be added to make it a great product.,4,True,0,2016-02-17
52172,Nice starter tablet,Purchased 6 of these tables for Christmas presents and was extremely surprised with how well they work for the price. The Amazon environment takes a little getting used to but the functionality of the tablet is great for the price.,5,True,2,2016-02-17
41872,Kindle Fire,Bought this one as a Christmas gift. Employee was very excited to receive and still loves the tablet.,5,True,0,2016-02-17
87578,great value,excellent for children school without breaking the bank,5,True,0,2016-02-26
66978,Excellent Tablet for the money,I love it because my grandson can use itEasily to play his games,5,True,0,2016-02-26
36078,Perfect travel size,Very happy with purchase. Would recommend to family and friends.,4,True,0,2016-02-26
5178,Fire Tablet,Great tablet for my kids or beginners.Highly recommend for all ages,5,True,0,2016-02-26
74381,Good for the price,This a good tablet. How ever I made it better by putting cyanogen mod on this to use the full android operating system,5,True,0,2016-02-26
64081,great kindle,It was a great purchase. I purchased 2 within one month.,5,True,0,2016-02-26
53781,Perfect size for Reading in bed,I had a kindle for years. It finally would not keep a charge. I like the smaller Kindle for my books so it is easy to hold in bed at nite. This is perfect.,5,True,0,2016-02-26
43481,Kindle fire is fire,Brought it for my husband and he absolutely loves it,5,True,0,2016-02-27
71484,Best Value Ever,I own several iPads but wanted to try one of these as I am an Amazon Prime member. These are a STEAL and what a value. The fact that you can insert a micro SD card to expand storage is a huge plus and I have been very pleased with the availability of APPs. I will be taking my this to Europe and have been able to download a bunch of movies for the trip from my Amazon Prime membership. I purchased at Best Buy with a gift card and now use it more than my iPad.,5,True,0,2016-03-04
19984,Need to push touch screen harder then Apple.,The apps offered was as expected. I was surprised that it was heavier than I w pe red.,4,True,0,2016-03-04
9684,amazing value,Great tablet for the price well built and worth every penny,5,True,0,2016-03-04
89187,Great entry level tablet,Great tablets for everyday use. My child watches his favorite YouTube videos on it.,3,True,0,2016-03-04
58287,amazon fire,my grandson loves it plays it all time loves the app. store,5,True,0,2016-03-03
17087,very good,It works good for kids and wherever you need for and good size,5,True,0,2016-03-04
96590,Refrigerate,I like to use my refrigerator it works like a champ and it freeze,4,True,0,2016-03-04
86290,Awesome tablet for a new user,This kindle was purchased for my mother. She took to the kindle with ease. She was able to navigate through the device without any problems. She is very happy with her kindle.,5,True,0,2016-03-04
45090,love it,i love this tablet. but my only complaint is the battery life. it sucks.,4,True,0,2016-03-04
24490,Great Gift,I bought this for my parents. It is easy to operate.,5,True,0,2016-03-04
93693,kindle fire,I love my kindle fire. It does exactly what I need it to do and more,5,True,0,2016-03-04
83393,Great tablet for the money,This is my second kindle fire I love the ease of use with the fire and all my books,5,True,0,2016-03-04
62793,The product is value its money,Bought it for my niece and nephews as a beginner tablet and turned out pretty well. Value buy.,5,True,0,2016-03-04
52493,excellent for my grandkids for school.............,The grandkids needed some research help for school. I researched and found that the Amazon tablet was the the best for any age. Best But was the best place to go for the best buy and price....,5,True,3,2016-03-20
42193,Easy to use,This product is very easy and light to use. Love it.,3,True,1,2016-03-20
31893,awesome,One of the best tablets other than android out there,5,True,1,2016-03-20
49596,Awesome tablet and cheaper,Great tablet with a lot of worth apps and everything for a low price.,5,True,1,2016-03-25
18696,Great for books and audiobooks,I use it for audiobooks a lot of the time . It has a good clear sound. Very easy to download books from the library .The battery seems to last a reasonable amount of time.,4,True,1,2016-03-25
87899,Great tablet,Love it whould tell everyone to get one buy it you will have tons of hours to do things.,5,True,1,2016-03-25
67299,Great for the price,Easy too use and a plus for wife to read books being a prime member,5,True,1,2016-03-25
15799,Fantastic product,This kindle is fast and affordable. I highly recommend it.,4,True,1,2016-03-25
5499,Love it,I bought this for my Mother. She loves it. She can play her games she likes and she can use kindle and audible all with just one device.,5,True,1,2016-03-26
95302,Great device,Really love it. Great display but not crazy about ads but still getting use to it.,4,True,1,2016-03-26
85002,great brought for a 5yr old,very easy to work the only thing i dont like the cord does not plug in good its like it not the cord for it,5,True,1,2016-03-26
23202,Tablet,My son really likes the kindle fire and it so easy for him to use,5,True,0,2016-06-24
2602,Excellent Product,Purchased for my son for ease of use and design. Would recommend.,5,True,0,2016-06-24
51205,good tab for the proce,brought it as a gift for my uncle and its a decent tab for the price.,3,True,0,2016-06-23
99808,I loved,this is the perfect table to download books from Amazon....,5,True,0,2016-06-25
89508,Great item Great price,Great item for Great price. Functions as expected.,4,True,0,2016-06-25
76311,Great little tablet for low price,I love this little tablet. My daughter loves free time app on it. She wants to play on the fire tablet more than her kids Samsung tab,5,True,0,2016-07-03
4211,Kindle is great for my 8 year old,Great phones for my sons that are 13 and my 8 year old lives his kindle,5,True,0,2016-07-02
94014,Great for my wife,this was great for my wife who just needed a basic tablet for web browsing and media consumption.,4,True,0,2016-07-08
83714,Great for kids,Tablet was purchased by our daughter with her own money. She worked her tail off for this tablet. She loves it and will be using for school and travel.,5,True,0,2016-07-08
73414,PERFECT,Right size for travel. Perfect for reading. Everyone should own one.,5,True,0,2016-07-07
63114,Great tablet for reading,The tablet is great for reading and watching movies,3,True,0,2016-07-07
32214,Good for kids,The fact that it has parental control so I can verify what they are downloading is great,4,True,1,2016-07-07
21914,Great tablet,Amazing tablet for the price i love it is really easy to use and light weight awesome speed,4,True,0,2016-07-07
11614,fire,I love my fire... The games and the pictures great,5,True,0,2016-07-08
91117,kindle,Great product easy to use. Having different color choices wonderful.,4,True,0,2016-07-08
19017,Travel lifesaver,Last minute online purchase before taking my daughter on a trip. It was ready for pick up in an hour and kept her entertained the entire ride.,5,True,0,2016-07-28
98520,Great Tablet for the Money,Excellent tablet for watching movies and TV. Get the extra memory SD card and you will be good to go.,5,True,1,2016-07-27
57320,Perfect for what we need,Great for things I need it for and is easy to store and put in my purse,5,True,1,2016-07-26
5820,Good low priced tablet,I bought this as a gift for my stepdaughter. She seems to be happy with it,4,True,1,2016-01-09
95623,another great kindle,Love the kindle product have purchased several kindles and several types and this is another great product. this model doesnt have the auto dimming feature that i like on previous model but still a great kindle,5,True,0,2016-01-09
85323,great for my kids,Bought this for my toddler and teen they both love it.,5,True,0,2016-01-09
75023,Does not work,Charge the device and was able to set up everything and when I came back to use it it would not work,1,False,1,2016-01-09
54423,Nice and cheap tablet,I bought it in thanksgiving.its very cheap and has got good features for that.,4,True,0,2016-01-10
92726,Awesome first tablet for kids,Bought this tablet foe my 8 years old son and he love it.,5,True,0,2016-01-10
72126,very easy to use,nice pickup for my wife who is just learing to use a tablet,5,True,0,2016-01-10
61826,A great tablet for the money,I have used tablets before that cost a lot more money. For the price this tablet is a bargain.,5,True,0,2016-01-10
51526,A great tool to use to read and surf the internet.,I love using it to read and surf the internet. It is also very handy.,1,True,2,2016-01-10
30926,Great for kids,Lots of apps for kids. My 5yr old loves it. Great buy.,4,True,0,2016-01-10
10326,Great for the price,I purchased two of these for my kids since they both wanted tablets for Christmas. We liked that they could use it like their own but we had total control of what the used and viewed. It is a lot faster than the older Kindle. It is pretty durable as well.,3,True,0,2016-01-10
89829,Good value,Internet sucks on this thing. They need to do something better. My phone is 3x faster.,4,True,0,2016-01-11
69229,Good product,My daughter can never put her fire tablet down she really loves it,5,True,0,2016-01-11
58929,Great Tablet for beginners,I purchased this for my stepdaughter. well her dad and I are no longer together we divorced 2 yrs ago. Both her parents could not purchase this for her. So Merry Christmas little one. She loves it . Easy to learn great for pictures,3,True,0,2016-01-11
38329,Met my expectations,Can not beat the quality of the product for the cost.,5,True,0,2016-01-11
56032,great kindle for your granddaughter,My granddaughter loves her Kindle Fire tablet. Easy to use and am purchasing one for my husband.,5,True,0,2016-01-12
25132,Amazon tablet,Great product. Purchased for my wife to replace her fire hd. She loves the screen and the fact that it fits in her pocketbook.,5,True,1,2016-01-13
1635,Great screen resolution,I bought 2 for my 4 and 5 year old and thet love it.,5,True,0,2016-01-15
19338,Perfect for any age,I purchased this tablet for my son to use after realizing he took mine over almost completely. He has no problems navigating from game to game. Excellent speed and love the HD screen.,4,True,0,2016-01-15
47341,Good tablet for the price,Tablet gets the job done and is very affordable for those who cannot buy an iPad but it is laggy at times and overall cannot stand with an iPad.,4,True,0,2016-01-15
75344,Easy to use,Practical and easy to use. Does what it needs to for the price,5,True,0,2016-01-16
54744,Okay,Okay new look is less appealing but seems to work okay,4,True,0,2016-01-16
44444,Amazon Fire tablet,I used it as a gift in an office holiday secret Santa,4,True,0,2016-01-15
82747,Great Value for the Price,Easy to use. Does it all. Faster than my other tablet.,5,True,0,2016-01-16
62147,Great,I would purchase again. Great product for the price.,5,True,0,2016-01-16
41547,Good tablet,Bought for kids. Happy with purchase.May get one for myself,5,True,1,2016-01-16
31247,Ease of use and flexibility,I appreciate the ease of use and the flexibility of the FIRE. Also its portability.,5,True,0,2016-01-16
56353,i had to return it,my gesr fit heart monitor was not compatible with android level,2,True,0,2016-01-17
94656,Merry Christmas,It was the perfect Christmas present. Made everyone smile,5,True,1,2016-01-18
84356,Good for smaller kids,From what I can tell my kids love these. I do wish there was an option to keep it on the kids profile though,4,True,1,2016-01-18
74056,amazon tablet,the tablet a 7inch starter tablet is very durable excellent tablet for kidsvery tough good processing speed.,5,True,2,2016-01-18
63756,Amazon fire,Amazon fire is cheap and best for reading and playing games. I bought this to gift someone and it was liked very much,4,True,2,2016-01-17
12256,They made a good gift.,I bought 6 of them. They made very good christmas gifts..,3,True,0,2016-01-19
9359,Great,Its a great tablet. Its easy to use and connect to wifis.,5,True,0,2016-01-22
88862,Brother in law loves it,Got it as an Xmas present for the brother in law. He loves it. Easy to read and play with,5,True,0,2016-01-22
78562,Easy to use,Great deal for the cost. Would purchase item again.,5,True,0,2016-01-22
37362,was a gift,Nit sure was s gift not sure what the product is like,3,True,0,2016-01-22
27062,Great.,Good purchase for a 10 year old to encourage reading.,4,True,0,2016-01-22
96265,love it,Love this tablet I got it for my two toddler sons and they love it as well,5,True,0,2016-01-22
85965,Great tablet for my son,This tablet is great and my 4 year old son can run it easily. I had to reset it when I first recieved it bit after that worked great. He plays lots of games and uses the audio books. The battery life is good as well and charges fast,4,True,0,2016-01-22
75665,Good tablet,It is running smooth and is a good tablet at a very low price.,4,True,0,2016-01-22
55065,Great for kids and pictures.,I have all bought all three of my girls Kindles and they have all been happy.,4,True,0,2016-01-23
34465,Excellent,I just would like to say I brought this tablet for my 11 year old. And she has had it in her hand ever since. Great buy,5,True,0,2016-01-29
24165,Nice tablet for child,We got this tablet for our grandson. The ease of operation is definitely thumbs up.,4,True,0,2016-01-29
3565,Not Bad,Got two of these for my father and mother in laws for Christmas and they absolutely love them. Easy to use and great first tablet.,5,True,0,2016-01-29
93368,Good tablet,For the cheaper price I really liked this tablet. We bought 2,4,True,0,2016-01-29
83068,Nice product great price,This is a great tablet. It is reasonably priced and has great quality.,5,True,0,2016-01-29
52168,Great Tablet for adults and kids,You cant go wrong with this for either your kids or a adult.,5,True,0,2016-01-29
31568,Good value,This is a great tablet for the money. Able to do everything a higher priced tablet does,4,True,0,2016-01-29
21268,Kid tested...Auntie approved,I bought this product for my nephew for Christmas. I was very impressed with how cheap it was price wise. He took it out of the box to use and it was very user friendly when it was set up. He enjoyed being able to download his games and how easy it was to use altogether. Thank you Best Buy and Amazon for making it the best Christmas ever,5,True,0,2016-01-29
10968,Great tablet for beginner or a second,Good first tablet or back up to take with you without hazard to a better one.,5,True,0,2016-01-29
668,Thinner and light weight,Love it because it is thin and light weight and bigger,5,True,0,2016-01-29
80171,Only getting better,These amazon kindle started off great and are only getting better. I really enjoy all the new features the new ones have.,5,True,0,2017-04-25
49271,Great tablet for my son,Wanted something not expensive but rather easy to use to watch children shows great choice,5,True,0,2017-04-25
38971,Great little tablet,Great tablet for kids or a stater tablet for someone.,5,True,0,2017-04-24
8071,Great tablet for kids,This tablet has been great so far. We use it a good bit in the car as well.,5,True,0,2017-04-24
87574,Very nice,The up grades where a very nice choice and better.,4,True,0,2016-01-08
77274,great tablet,Love it. Got it for my grandson. Since i have amazon prime. He can watch alot of free movies and games,5,True,0,2016-01-08
66974,Ok product,Good beginner tablet for older person who likes surf Internet.,3,True,0,2016-01-08
46374,Great value,works great for kids bought three for Christmas no complaints,4,True,0,2016-01-08
15474,Like the kindle,Great product for the dollar. Recommend this item to others.,5,True,0,2016-01-09
94977,Great tablet for the cost but low on storage,I gave this as a gift and so I heard it has been working very well,3,True,0,2016-01-09
2277,Ok so far,My 3yr old grandson loves it. Will only be used for him,3,True,0,2016-12-30
40580,My son love it,My son is very happy for this tablet that I gave him for Christmas,4,True,0,2017-01-07
9680,Yes,I recommend you good product you can buy it at bestbuy in my favorite shop buy it now,5,True,0,2017-01-07
99483,great device,great handheld device for starters and easy to handle,5,True,0,2017-01-07
17083,amazon,bought this tablet for a great price and would recomend it,5,True,0,2017-01-08
86286,Great tablet,My kids love their new tablets and it was a great price.,5,True,0,2017-01-08
75986,great,Love it my kids love it nice to travel with nice pictures,5,True,0,2017-01-08
65686,Replacement Kindle,I had to replace my last Kindle so I made a quick run to Best Buy. Got a great deal and purchased the replacement insurance. Kindle works fine. It is slow and needs to be restarted frequently. Pretty much the same as the last Kindle,4,True,0,2017-01-16
45086,Its working fine,Its a great gift for my little one and he loves it,3,True,0,2017-01-16
24486,great for my 12 year old,My 12 year old loves it. She uses it to watch YouTube and stream music.,5,True,0,2017-01-16
14186,Great tablet for the price,Bought this for my son in Christmas and it was worth the price. Get the protective cover on Amazon. Great for kids and anyone who enjoys reading,4,True,0,2017-01-16
3886,Great tablet,Great value. Easy to use. Fun to use. Easy to set up.,5,True,0,2017-01-16
93689,Great Tablet,Bought two...one for each kid for Christmas. Perfect for the kids. Download their shows and music. Keeps them off ours. Durable enough for them to use on their own.,5,True,0,2017-01-16
83389,The kids find it usable,Bought for grandson who loves it. Used for travel.,5,True,0,2017-01-17
42189,Get something better,The best advice I can give after 3 devices and 2 years later,2,False,0,2017-01-17
59892,Great Tablet,Fast and easy to use. Downloading apps is convenient.,5,True,0,2017-02-26
39292,Pretty basic but works,Pretty basic tablet. Lagging processor but it works.,3,True,0,2017-02-25
8392,Good Performance,Highly Satisfied with the product. Great price and performance,5,True,0,2017-03-06
98195,perfect for the kids,Purchased several tablets for the children for gifts. Easy to use hang the kids love them. My only complaint is that the charger could be more durable,4,True,0,2017-03-06
67295,Great tablet,Got his tablet for my 7 year old she so she could play apps and watche videos. Works great and to be able to add memory is a plus.,5,True,0,2017-03-06
5495,great,i bought this and i really enjoy using it. fits my needs.,5,True,0,2017-03-15
12898,Good,good product for the price..Holds a decent charge and surfs the web just find..I have also steamed videos on this device with no issues.,5,True,0,2017-03-25
92401,Great for young kids,This tablet is perfect for a parent who wants to monitor what their children are doing. As well as being able to control what their kids can and can not do on the internet.,4,True,0,2017-03-25
71801,Fire Tablet,I love my new Amazon Fire tablet. Its so easy to use and stays charged for a nice amount of time.,5,True,0,2017-03-25
51201,Great tablet,This is a really great tablet me and my kids love it.,5,True,0,2017-03-27
30601,Nice screen.,What a great price and very easy to use.Had a little trouble getting past my secured connection though.,4,True,0,2017-03-27
68904,Great tablet,I bought this for my son. Some of his homework needs to be done online and the tablet worked perfectly for it. He could also use it at the zoo to take pictures and use it to play games.,5,True,0,2017-04-13
38004,Awesome,This was my second one I have bought. These are not water proof,5,True,0,2017-04-11
27704,Great tablet,Great tablet from a great company will stay with this company for all other tablet purchases,5,True,0,2017-04-11
96907,Great product,Very convenient for a great low price. It does its job.,5,True,0,2017-04-10
86607,Great for the price,Nice little tablet. Touch sensitivity not as great as high end tablet but definitely worth the trade off in price.,4,True,0,2016-12-23
76307,Good,Using the unit to play games and read. Good Enjoyed using,5,True,0,2016-12-23
14507,Excellent,Great tablet for the price. I got 2 for my kids and they love it,5,True,0,2016-12-23
94010,Great features for children,Its awesome to be able to set certain features to ensure that the child user gets work done prior to free play.,5,True,0,2016-12-23
83710,Great tablet,Great tablet for the money just wish they would add Bluetooth.,5,True,0,2016-12-23
63110,Great for price,I got this for my niece for Christmas she is going to live it,5,True,0,2016-12-23
52810,Great tablet for reading everyday.,This tablet makes reading and watching video more enjoyable.,5,True,0,2016-12-23
42510,Great,Whole family has there own and we all love them no matter what we want to do,5,True,0,2016-12-23
91113,Great for kids,Great product for the price. I got it for my kids during thanksgiving and they love it,4,True,0,2016-12-24
39613,Great buy,Really enjoyed purchasing thus product for little ones,5,True,0,2016-10-19
19013,Its a very good tablet,I really like the kindle fire and would recommed it to anyone that is looking for tablet,5,True,0,2016-10-19
88216,Great sound for the size,Does the job. Kids are kinda of rough with its holding up well,4,True,0,2016-10-19
57316,Inexpensive tablet,If you are looking for an inexpensive tablet that can keep up with everyday casual use then this tablet is a good buy.,3,True,0,2016-12-03
47016,Christmas gift,This will be great for my parents who are older because it easy to use.,5,True,0,2016-12-03
64719,great product and price,I bought this for my mother in law. I have a Kindle and I absolutely love it. Perfect if you only want a tablet for reading books.,5,True,0,2016-12-07
54419,Good Quality for the price,It is a good buy for the price and the performance is also awesome,5,True,0,2016-12-07
41222,Great Fire,nice for this price................................,4,True,1,2016-04-26
10322,Nice tablet,The kindle is my favorite tablet for reading books,5,True,0,2016-05-19
69225,Great Kindle Fire,This is a great Kindle. It has great sound and clarity of the screen. Easy to use.,5,True,0,2016-05-19
7425,Great for children,Bought for my son and he loves it. Fast and great for playing games,5,True,0,2016-06-02
76628,The tablet is good for the price,I needed something bigger than my phone screen to browse with and came across this tablet. The screen quality is good,4,True,0,2016-05-31
